Symbol,Name,Last Sale,Net Change,% Change,Market Cap,Country,IPO Year,Volume,Sector,Industry
VRTX,Vertex Pharmaceuticals Incorporated Common Stock,$307.09,-7.10,-2.26%,78827377995.00,United States,1991,2006329,Health Care,Biotechnology: Pharmaceutical Preparations
VTRS,Viatris Inc. Common Stock,$11.34,0.20,1.795%,13751843341.00,United States,,12107375,Health Care, Medicinal Chemicals and Botanical Products 
WBA,Walgreens Boots Alliance Inc. Common Stock,$41.03,-0.03,-0.073%,35381573457.00,United States,,6089282,Consumer Staples,Retail-Drug Stores and Proprietary Stores
WBD,Warner Bros. Discovery Inc. Series A Common Stock ,$10.89,-0.38,-3.372%,26445232603.00,United States,,29922774,Telecommunications,Cable & Other Pay Television Services
WDAY,Workday Inc. Class A Common Stock,$177.33,4.60,2.663%,45573810000.00,United States,,2998599,Technology,Computer Software: Prepackaged Software
WDC,Western Digital Corporation Common Stock,$36.30,0.09,0.249%,11530705709.00,United States,,5905589,Technology,Electronic Components
WMG,Warner Music Group Corp. Class A Common Stock,$34.28,0.95,2.85%,17649192446.00,United States,2020,1510763,Consumer Discretionary,Movies/Entertainment
XEL,Xcel Energy Inc. Common Stock,$71.60,0.01,0.014%,39182992314.00,United States,,3170997,Utilities,Power Generation
ZBRA,Zebra Technologies Corporation Class A Common Stock,$263.27,5.17,2.003%,13592576919.00,United States,1991,608689,Technology,Computer peripheral equipment
ZI,ZoomInfo Technologies Inc Common Stock,$31.07,0.88,2.915%,12541623270.00,United States,2020,5362617,Technology,Computer Software: Prepackaged Software
ZM,Zoom Video Communications Inc. Class A Common Stock,$74.05,0.36,0.489%,21646461057.00,United States,2019,4017849,Technology,Computer Software: Prepackaged Software
ZS,Zscaler Inc. Common Stock,$123.76,2.52,2.079%,17847705214.00,United States,2018,2602298,Technology,EDP Services
